symbol,companyName,isin,industry,sector,website,description,address,city,zip,ipoDate
ASLC.JK,PT Autopedia Sukses Lestari Tbk,ID1000165806,Auto - Dealerships,Consumer Cyclical,https://www.autopedia.id,"PT Autopedia Sukses Lestari Tbk, through its subsidiary, PT JBA Indonesia, engages in the auction of two and four-wheeler vehicles in Indonesia. The company is also involved in the retail sale of new and used car and motorcycles, as well as provides price data. In addition, it engages in the publishing of software; operation of commercial-purpose Web portals and/or digital platforms; and provision of business consulting and brokerage activities. PT Autopedia Sukses Lestari Tbk was formerly known as PT Adi Sarana Lelang and changed its name to PT Autopedia Sukses Lestari Tbk in September 2021. The company was founded in 2013 and is headquartered in Jakarta Utara, Indonesia. PT Autopedia Sukses Lestari Tbk is a subsidiary of PT Adi Sarana Armada Tbk.",Graha Kirana Lt. 6,Jakarta Utara,14350,2022-01-25
AVIA.JK,PT Avia Avian Tbk,ID1000165004,Chemicals - Specialty,Basic Materials,https://avianbrands.com,"PT Avia Avian Tbk manufactures and distributes paints and building materials in Indonesia. The company operates in two segments, Architectural Solutions and Trading Goods. The Architectural Solutions segment offers base, metal, wood, wall, boat, epoxy, and enamel paints; processed pigments and dyes, dyes and opacifiers, enamel polish and coatings, lacquers, and other preparations; and printing inks and art paints. It also provides varnishes, such as organic composite solvents and thinners, as well as paint or varnish removers, such as mastic; putty and plaster or putty compounds and non-refractory putty or related surface-covering materials; adhesives/glues comprising starch, bone adhesives, cellulose esters and ethers, phenol formaldehyde, urea formaldehyde, melamine formaldehyde, and epoxy adhesives for industrial or household purposes; and ready mixed and dry mixed concrete and mortar. In addition, this segment produces organic chemicals, dyes, and pigments with their cyclical intermediates, such as phenol intermediates and their derivatives, textile dyes, and dyes for food and medicine; artificial resins and plastic raw materials, such as alkyds, polyesters, aminos, polyamides, epoxides, silicones, polyurethanes, polyethylene, polypropylene, polystyrene, polyvinyl chloride, cellulose acetate, and cellulose nitrate; and metal/canned containers consisting of food/beverage cans, paint/other chemical cans, barrels, drums, buckets, boxes, jerrycans, and others. The Trading Goods segment trades in various paints for construction materials, such as base, metal, wood, and wall paints; engages in the retail trade of enamel, putty, and plasters; and sells pipes, furniture, and supporting products needed for painting process, such as paint rollers, paint brushes, seal tapes, and sandpapers. PT Avia Avian Tbk was founded in 1978 and is headquartered in Surabaya, Indonesia.",Jalan Surabaya-Sidoarjo KM. 19,Surabaya,61254,2021-12-08
BMRI.JK,PT Bank Mandiri (Persero) Tbk,ID1000095003,Banks - Regional,Financial Services,https://bankmandiri.co.id,"PT Bank Mandiri (Persero) Tbk provides various banking products and services to individuals and businesses in Indonesia, Singapore, Hong Kong, Timor Leste, Shanghai, Malaysia, the United Kingdom, and the Cayman Islands. It offers savings and current accounts, time deposits, demand deposits, and foreign currency savings and current accounts; motorcycle loans, mortgage loan, and housing loans, as well as loans for various purposes, such as education, home renovation, marriage, health, and other needs for individuals; and working capital loans, investment loans, people's business loans, syndicated loans, and micro business loans for businesses. The company also provides investment products comprising mutual funds, stocks, and bond trading; life, health, and general insurance products; credit, debit, and corporate cards; e-banking services; digital lending; cash management services; trade finance services, value chain, supply chain management, global and domestic trade, export and import, standby letter of credit, and bank guarantee, as well as spot and forex services; custodial services; treasury services, including cash transaction/liquidity, hedging, and investment products; trust services comprising trustee, paying agent, security agent, escrow agent, monitoring agent, and receiving bank services; and money transfer, remittance services, and venture capital financing. As of 31 December 2021, it operated 2,609 branches, including 137 branch offices, 2,465 sub-branch offices, and 7 overseas branch offices; and 13,087 ATM facilities. The company was founded in 1998 and is headquartered in Jakarta, Indonesia.",Plaza Mandiri,Jakarta,12190,2003-07-14
ATLA.JK,Atlantis Subsea Indonesia Tbk.,ID1000203607,Oil & Gas Equipment & Services,Energy,https://www.atlantissubsea.com,"PT Atlantis Subsea Indonesia Tbk provides multi-disciplinary survey support and solutions for the oil and gas, energy and renewable energy, and marine infrastructure sectors in Indonesia. It offers post construction support, inspection repair maintenance support, construction support, survey and positioning, geophysical and geotechnical survey, and ROV support services. The company was founded in 2016 and is based in Jakarta Selatan, Indonesia.",Jl. Tebet Barat Dalam Raya No. 6,Jakarta Selatan,12810,2024-04-16
FISH.JK,PT FKS Multi Agro Tbk,ID1000080104,Agricultural Farm Products,Consumer Defensive,https://www.fksmultiagro.com,"PT FKS Multi Agro Tbk, together with its subsidiaries, supplies food and feed ingredients in Indonesia. It operates through three segments: Trading and Distribution, Manufacturing, and Logistics. The company engages in the wholesale trading of food and beverages, agricultural products and live animals, rice and secondary crops, and other goods. It also provides fermented and non-fermented soybean products, including soybean meals and rapeseed meals; grain milling co-products, consisting of corn, dried distiller's grains soluble, wheat bran, and corn gluten meal; and fish meals and fish oils, meat bone meals, poultry meat meals, and mono/di calcium phosphates for animal feeds. In addition, the company offers logistics services comprising port logistics and handling, stevedoring, warehouse management, transportation, and distribution services, as well as bulk handling, cargo storage and packaging, and weighing services. Further, it is also involved in the development and management of industrial zones; provision of consulting and management services; and provision of loading and unloading services. Additionally, the company engages in the industrial operation, service sector, real estate, warehousing, art, entertainment and recreation, lodging and boarding, and rental and operating lease activities. It serves aquaculture and animal feed industries, and food processors. The company was formerly known as PT Fishindo Kusuma Sejahtera. PT FKS Multi Agro Tbk was incorporated in 1992 and is headquartered in Central Jakarta, Indonesia. PT FKS Multi Agro Tbk is a subsidiary of PT FKS Corporindo Indonesia.",Menara Astra,Jakarta Pusat,10220,2002-01-18
BMTR.JK,PT Global Mediacom Tbk,ID1000105604,Entertainment,Communication Services,https://mediacom.co.id,"PT Global Mediacom Tbk operates as an integrated media company in Indonesia and internationally. It operates four free-to-air TV stations, including RCTI, MNCTV, GTV, and iNews; and provides content production and content library services. The company also owns and operates okezone.com, sindonews.com, iNews.id, idxchannel.com, celebrities.id, sportstars.id, and BuddyKu; various portals and new apps; network of radio stations, which include approximately 100 radio stations under 4 principal brands MNC Trijaya, RDI, Global Radio, and V Radio; Over-The-Top services under RCTI+ name; Vision+ to watch content; MNC Vision, a subscription DTH service; and K-Vision, a DTH based pay-TV service. In addition, it operates MNC Play, that offers high-speed internet and IPTV services; MeTube.id, a video sharing platform; Mediate local media agencies that provides integrated media placement services; MNC Licensing, a licensing and brand management service; Movieland, special economic zone for integrated film industry and drama series; and MNC Shop, a TV home shopping channel, as well as provides talent management, advertising-based media and content, subscription based media and fixed broadband, online media, supporting media and infrastructure, advertising services. The company was formerly known as PT Bimantara Citra Tbk. and changed its name to PT Global Mediacom Tbk in March 2007. The company was founded in 1981 and is based in Jakarta Pusat, Indonesia.",MNC Tower,Jakarta Pusat,10340,2005-09-29
HDFA.JK,PT Radana Bhaskara Finance Tbk,ID1000118805,Financial - Credit Services,Financial Services,https://www.radanafinance.co.id,"PT Radana Bhaskara Finance Tbk primarily engages in financing activities in Indonesia. The company's financing services comprise working capital financing, investment financing, multipurpose financing, sale and purchase financing, and services financing. As of December 31, 2021, it operated 9 branch offices located in Tanggerang, Bekasi, Cimahi, Depok, Semarang, Surakarta, Surabaya, Medan, Palembang, and Cipondoh. The company was formerly known as PT HD Finance Tbk and changed its name to PT Radana Bhaskara Finance Tbk in June 2014. The company was incorporated in 1972 and is headquartered in Jakarta, Indonesia. PT Radana Bhaskara Finance Tbk is a subsidiary of Rubicon Investments Holding Pte. Ltd.",CIBIS Nine Building,Jakarta,12560,2011-05-10
SMMA.JK,PT Sinar Mas Multiartha Tbk,ID1000094501,Insurance - Diversified,Financial Services,https://www.smma.co.id,"PT Sinar Mas Multiartha Tbk provides various financial services to individual and corporate clients in Indonesia. The company offers savings and current accounts; time deposits, deposit on call, and Syariah funding; trade finance, remittance, foreign exchange, and bond trading; bancassurance and mutual funds; internet, mobile, and phone banking; debit and credit cards; ATMs; safe deposit box, travellers cheque, payroll, bill payment, and virtual accounts. It also provides investment, working capital, multi-purpose, sharia, and other financing products; online/information technology-based money lending services; securities and commodity trading, securities administration bureau, general trading, property, information technology, venture capital, fund management, automotive, guarantee, and forestry services. The company was formerly known as PT Internas Artha Finance Company and changed its name to PT Sinar Mas Multiartha Tbk in February 1995. The company was founded in 1982 and is headquartered in Jakarta Pusat, Indonesia. PT Sinar Mas Multiartha Tbk is a subsidiary of PT Sinar Mas Cakrawala.",Menara Tekno Lt. 7,Jakarta Pusat,10350,2003-03-04
WICO.JK,Pt Wicaksana Overseas International Tbk,ID1000066301,Food Distribution,Consumer Defensive,https://www.wicaksana.co.id,"Pt Wicaksana Overseas International Tbk engages in the distribution and trading of food, beverage, and other products in Indonesia. The company operates through two segments, Distribution and Trading Centre. It offers snacks, beverages, milk powder, instant noodles, personal care products, cosmetics, medicines, household products, cooking oil, and plastic and electrical materials, as well as over the counter and consumer health products, and medical devices. The company also provides patient, commercial, regulatory support, and distribution services. It operates through a network of 33 distribution centers. The company was founded in 1973 and is headquartered in Jakarta Utara, Indonesia. Pt Wicaksana Overseas International Tbk is a subsidiary of DKSH Holding AG.",Jalan Ancol Barat VII,Jakarta Utara,14430,2001-04-05
TELE.JK,PT Tiphone Mobile Indonesia Tbk,ID1000122104,Telecommunications Services,Communication Services,https://www.tiphone.co.id,"PT Tiphone Mobile Indonesia Tbk engages in the trading of telecommunication devices in Indonesia. The company offers mobile phones and spare parts, accessories, prepaid and postpaid cards, and recharge vouchers, as well as hardware and software repair services through its Telesindo Shop and Samsung Experiential Shop stores. It also operates as a mobile phone content provider. The company was founded in 2008 and is headquartered in Jakarta Barat, Indonesia.",Telesindo Tower,Jakarta Barat,11140,2012-01-12
INCF.JK,PT Indo Komoditi Korpora Tbk,ID1000086200,Chemicals - Specialty,Basic Materials,https://indokomoditikorpora.com,"PT Indo Komoditi Korpora Tbk produces and trades in rubber. It offers crumb rubber and dry jelutong that are used in tires, tube hoses for machines, insulators, waterproofing, and other applications. The company sells its products to Mexico, Argentina, Brazil, Turkey, Germany, Finland, Russia, China, Australia, South Korea, Japan, and India. PT Indo Komoditi Korpora Tbk was founded in 1955 and is headquartered in Jakarta, Indonesia.",Centennial Tower,Jakarta,12930,2002-06-14
BABP.JK,PT Bank MNC Internasional Tbk,ID1000091507,Banks - Regional,Financial Services,https://www.mncbank.co.id,"PT Bank MNC Internasional Tbk provides various banking products and services in Indonesia. It operates through Business, Consumer, Treasury, and Others segments. The company accepts demand, savings, and time deposits, as well as certificate of deposits. Its loan products include working capital, investment, property, housing, motorcycle, car, and other unsecured loans. The company also offers credit cards; money market; trading; treasury services, including foreign exchange and retail bonds; trade finance services, such as export, import, and local transactions; and bancassurance, overdrafts, and online and mobile banking services, as well as automated teller machine (ATM) services. As of December 31, 2021, it operated 16 main branch offices, 25 supporting branch offices, 1 functional office, and 70 ATMs. The company was formerly known as PT Bank ICB Bumiputera Tbk and changed its name to PT Bank MNC Internasional Tbk in April 2014. PT Bank MNC Internasional Tbk was founded in 1989 and is headquartered in Jakarta Pusat, Indonesia.",Gedung MNC Financial Center,Jakarta Pusat,10340,2002-07-15
TAYS.JK,PT Jaya Swarasa Agung Tbk,ID1000164601,Packaged Foods,Consumer Defensive,https://www.taysbakers.com,"PT Jaya Swarasa Agung Tbk manufactures snack food products in Indonesia. The company offers wafer rolls under the Miniro, Wasuka, Nitchi Wafer Stick, and Chizku brands; crisps under the Tricks Crisps, Tiles Potato Crackers, and 5 Potato Crisps brands; chocolates under the Nitchi Paste and Nitchi Sprinkle brand name; snacks under the Doomoe Long brand; and ekstrudat under the Doomoe Corn brand name. It also provides biscuits and puffs. The company exports its products to Taiwan, Australia, China, Korea, Southeast Asia, the Middle East, and the United States. PT Jaya Swarasa Agung Tbk was founded in 1998 and is based in Tangerang, Indonesia.",Jalan Parung Panjang Raya No. 68,Tangerang,15820,2021-12-06
GHON.JK,PT Gihon Telekomunikasi Indonesia Tbk,ID1000142300,Telecommunications Services,Communication Services,https://www.gihon-indonesia.com,"PT Gihon Telekomunikasi Indonesia Tbk provides telecommunications support services in Indonesia. The company engages in the engineering, design, construction, installation, and network integration of telecommunication towers. It also provides leasing, operation, and maintenance services. The company was founded in 2001 and is based in Jakarta, Indonesia.",APL Tower – Central Park,Tangerang,11470,2018-04-09
ACST.JK,PT Acset Indonusa Tbk,ID1000127509,Engineering & Construction,Industrials,https://www.acset.co,"PT Acset Indonusa Tbk provides construction and related support services in Indonesia. The company operates through Construction, Construction Support Services, and Trading segments. It builds office blocks, mall and shopping area, hotel and residential, industrial building, and other projects, as well as silos, power plants, and toll-roads. The company also undertakes demolition, foundation, building and civil construction, and infrastructure projects, as well as mechanical, electrical, and plumbing works; and provides construction support services. In addition, it is involved in the wholesale of heavy equipment. The company was incorporated in 1995 and is based in Jakarta, Indonesia. PT Acset Indonusa Tbk is a subsidiary of PT Karya Supra Perkasa.",ACSET Building,Jakarta,10160,2013-06-24
MYRX.JK,PT Hanson International Tbk,ID1000059603,Real Estate - Development,Real Estate,https://www.hanson.co.id,"PT Hanson International Tbk, together with its subsidiaries, engages in the development of real estate properties in Indonesia. It develops residential, commercial, shop house, and office properties. The company was formerly known as PT Hanson Industri Utama Tbk. PT Hanson International Tbk was founded in 1971 and is headquartered in South Jakarta, Indonesia.",Mayapada Tower 1,Jakarta Selatan,12920,2000-11-17
BMHS.JK,PT Bundamedik Tbk,ID1000161201,Medical - Care Facilities,Healthcare,https://www.bmhs.co.id,"PT Bundamedik Tbk provides health care services in Indonesia. As of December 31, 2021, the company operated 2 maternal and child hospitals, 3 general hospitals, 2 clinics, 10 IVF clinics, and 14 diagnostic laboratories. It also engages in the distribution of drugs, pharmaceuticals, and medical devices; and hotel, medical tourism, and management consulting businesses. The company was founded in 1973 and is headquartered in Jakarta Pusat, Indonesia. PT Bunda Medik is a subsidiary of PT Bunda Investama Indonesia.",Jl. Teuku Cik Ditiro No.28,Jakarta Pusat,10350,2021-07-06
TALF.JK,PT Tunas Alfin Tbk,ID1000130107,Packaging & Containers,Consumer Cyclical,https://www.tunasalfin.com,"PT Tunas Alfin Tbk manufactures and sells packaging products in Indonesia. The company offers dry and wet, wax, extrusion, and solventless lamination; paper and board metallizing; and printing services, as well as produces release paper and adhesive coating products. It serves cigarette, consumer food, and health and hygiene products manufacturing industries. The company was founded in 1977 and is headquartered in Tangerang, Indonesia. PT Tunas Alfin Tbk operates as a subsidiary of PT Proinvestindo.",Jalan K.H. Agus Salim No. 9,Tangerang,15119,2014-01-17
HERO.JK,PT DFI Retail Nusantara Tbk,ID1000122708,Department Stores,Consumer Cyclical,https://www.dfinusantara.co.id,"PT DFI Retail Nusantara Tbk engages in the management and operation of supermarkets, hypermarkets, and minimarkets. It operates through the Supermarket and Special Retails segments. The company was founded by Muhammad Saleh Kurnia on October 5, 1971, and is headquartered in Tangerang Selatan, Indonesia.",Gedung Graha Hero,Tangerang Selatan,15224,2001-06-29
CBPE.JK,PT Citra Buana Prasida Tbk,ID1000181407,Real Estate - Development,Real Estate,https://www.citrabuanaprasida.co.id,"PT Citra Buana Prasida Tbk operates as a property developer and manager in Indonesia. It develops, sells, and rents shophouses. The company was founded in 2000 and is headquartered in Bandung, Indonesia. PT Citra Buana Prasida Tbk is a subsidiary of PT Sandhi Parama Nusa.","Blok G, No. 206 – 208",Bandung,40181,2023-01-06
JGLE.JK,PT Graha Andrasentra Propertindo Tbk.,ID1000137409,Leisure,Consumer Cyclical,https://www.jungleseries.co.id,"PT Graha Andrasentra Propertindo Tbk. engages in the development and management of amusement/recreation parks. The company operates through four divisions: Hotel and Condotel, Real Estate, Recreation Park, and Others. It also manages the Jungle Waterpark, Jungleland Adventure Theme Park, and Jungle Festival. In addition, the company is involved in the development and sale of houses and apartments; management of the Bogor Nirwana Residence area; and management of Aston Bogor Hotel and Resort. PT Graha Andrasentra Propertindo Tbk. was founded in 1988 and is based in Bogor, Indonesia.",GAP OFFICE,Bogor,16132,2016-06-29
CSAP.JK,PT Catur Sentosa Adiprana Tbk,ID1000108301,Industrial - Distribution,Industrials,https://www.csahome.com,"PT Catur Sentosa Adiprana Tbk, through its subsidiaries, distributes building materials, chemicals, and consumer products in Indonesia. The company distributes building materials, including granite porcelain tiles; chemicals materials for industrial usage; and consumer goods, such as foods, daily necessities, and household goods. It also distributes construction materials; retails equipment; distributes and imports wooden furniture and souvenirs; develops warehouse areas; and rents land and building. In addition, the company operates retail stores under the Mitra10 and Atria names. PT Catur Sentosa Adiprana Tbk was founded in 1966 and is headquartered in Jakarta Barat, Indonesia.",Jl. Daan Mogot Raya No. 234,Jakarta Barat,11510,2007-12-12
BIPI.JK,PT Astrindo Nusantara Infrastruktur Tbk,ID1000114101,Industrial - Infrastructure Operations,Industrials,https://www.astrindonusantara.com,"PT Astrindo Nusantara Infrastruktur Tbk, together with its subsidiaries, operates in coal mining infrastructure in Indonesia. The company operates through Port Services; and Coal Mining and Others segments. It provides coal-mining facilities, including overland conveyors, coal crushers, coal stockpiles, and coal handling ports. The company also operates two ports in South Kalimantan and one port in East Kalimantan. In addition, it engages in the exploration, production, and infrastructure of coal mining; construction and trading activities; and rental of coal harbor and facilities. The company was formerly known as PT Benakat Integra Tbk and changed its name to PT Astrindo Nusantara Infrastruktur Tbk in May 2018. PT Astrindo Nusantara Infrastruktur Tbk was founded in 2007 and is headquartered in Jakarta, Indonesia.",Sopo Del Office Tower B,Jakarta,12950,2010-02-11
TPMA.JK,PT Trans Power Marine Tbk,ID1000126600,Marine Shipping,Industrials,https://www.transpowermarine.com,"PT Trans Power Marine Tbk provides bulk cargo transportation and transshipment services in Indonesia and Southeast Asia. It transports bulk commodities, such as iron ore, sand, coal, wood pellets, gypsum, woodchips, clinker, sponge rotary kiln, etc. As of December 31, 2021, the company operated a fleet of 74 units, including 38 tugboats, 33 barges, and 3 crane barges. The company was founded in 2005 and is headquartered in Jakarta Selatan, Indonesia. PT Trans Power Marine Tbk is a subsidiary of PT Dwitunggal Perkasa Mandiri.",Centennial Tower Building,Jakarta Selatan,12930,2013-02-20
ABBA.JK,PT Mahaka Media Tbk,ID1000087208,Publishing,Communication Services,https://www.mahakamedia.com,"PT Mahaka Media Tbk, through its subsidiaries, operates as a multiplatform media company in Indonesia and internationally. It engages in making, selling, collecting, and distributing community contents through various platforms. The company publishes Harian Republika Daily, a Moslem newspaper; Republika Penerbit, which specializes in Islamic reference books, novels, and children stories; Golf Digest, a golf media, including e-magazine, e-newsletter, and social media, as well as golfdigest.id, a Website; and Harian Indonesia, a Chinese-language newspaper. It also provides Republika Media Visual, which offers content and program with Islamic background; Jak TV, a television station; and various commercial radio stations, including JAK 101 FM, GEN 98.7 FM Jakarta, GEN 103.1 FM, Surabaya, HOT 93.2 FM, Most Radio 105.8 FM, KIS 95.1 FM, and Mustang 88.0 FM. In addition, the company offers outdoor advertising media services under the Mahaka Advertising name; brand activation services under the Alive Indonesia name; and discount services under the CardPlus name. Further, it provides online services through Jak-tv.co.id, 98.7 GenFM.co.id, 101 JakFM.co.id, and Republika.co.id. The company was formerly known as PT Abdi Bangsa Tbk and changed its name to PT Mahaka Media Tbk in May 2010. PT Mahaka Media Tbk was founded in 1992 and is headquartered in Jakarta, Indonesia. PT Mahaka Media Tbk is a subsidiary of PT Beyond Media.",Sahid Office Boutique,Jakarta,10220,2005-10-17
ERTX.JK,PT Eratex Djaja Tbk,ID1000076607,Apparel - Manufacturers,Consumer Cyclical,https://www.eratexco.com,"PT Eratex Djaja Tbk manufactures and sells garments in Indonesia and internationally. The company offers jeans, casual dress pants, denims, and Italian twills. It also provides personal protective equipment, including masks, hazmat suit, medical gown, and head and shoe covers; and engages in general trading business. The company was founded in 1972 and is headquartered in Surabaya, Indonesia. PT Eratex Djaja Tbk is a subsidiary of PT Ungaran Sari Garments.",Spazio Building,Surabaya,60226,2001-12-13
PLAN.JK,PT Planet Properindo Jaya Tbk,ID1000157407,Travel Lodging,Consumer Cyclical,https://www.planetproperindojaya.com,"PT Planet Properindo Jaya Tbk engages in hotel operation business. It operates Vue Palace hotel, a 4-star hotel located in Bandung, which includes superior, deluxe, and junior suite and suite rooms, as well as restaurant, poolside bar, meeting rooms, outdoor swimming pool, cafe, and gymnasium spa and fitness facilities. The company is based in Bandung, Indonesia.",Jl. Otto Iskandar Dinata No.3,Bandung,40117,2020-09-15
