symbol,companyName,isin,industry,sector,website,description,address,city,zip,ipoDate
PZZA.JK,PT Sarimelati Kencana Tbk.,ID1000143407,Restaurants,Consumer Cyclical,https://www.sarimelatikencana.co.id,"PT Sarimelati Kencana Tbk. operates Pizza Hut restaurants. The company operates restaurants under a franchise agreement with Yum! Asia Franchise Pte. Ltd. As of December 31, 2021, it operated 540 outlets in Jakarta and other cities in Indonesia. The company was founded in 1987 and is headquartered in Jakarta Selatan, Indonesia. PT Sarimelati Kencana Tbk. is a subsidiary of PT Sriboga Raturaya.",Graha Mustika Ratu,Jakarta Selatan,12870,2018-05-23
FLMC.JK,PT Falmaco Nonwoven Industri Tbk,ID1000161300,Household & Personal Products,Consumer Defensive,https://falmaco.my-free.website,"PT Falmaco Nonwoven Industri Tbk manufactures and sells tissue products and nonwoven fabrics in Indonesia and internationally. The company's products include wet wipes, baby care products, daily and personal care wipes, and other health products. Its products also include nonwoven dry and sanitizing wash gloves, bed sheets and linens, antiseptic hand sanitizers, hand sanitizing wipes, alcohol swabs and surface sanitizing wipes, fogging liquid, sterile nonwoven gauzes, protective coverall seals and non-seals, surgical gowns and masks, and disposable aprons. The company was founded in 1996 and is based in Padalarang, Indonesia.",Jl. Raya Padalarang 289 Km 15.3,Padalarang,40553,2021-07-08
BBRI.JK,PT Bank Rakyat Indonesia (Persero) Tbk,ID1000118201,Banks - Regional,Financial Services,https://bri.co.id,"PT Bank Rakyat Indonesia (Persero) Tbk provides various banking products and services in Indonesia, Singapore, Timor Leste, Hong Kong, Taiwan, Singapore, and the United States. The company offers current and savings accounts; time deposits; house, micro business, working capital, investment, food, warehouse receipt, partnership, franchise, and cash collateral loans; and supply chain financing solutions. It also provides banking services, such as bill payment, deposit, online transaction, money transfer, and remittance services; investment products, such as pension and mutual funds, and retail bonds and retail sukuk products; import and export services; letter of credits; and BRI RTE online system and money changer services. In addition, the company offers Internet banking and merchant services; credit cards; wealth management services; business guarantee and clearing business services; financial and institutional business banking services; and treasury, custodian, trustee, and cash management services. PT Bank Rakyat Indonesia (Persero) Tbk was founded in 1895 and is headquartered in Jakarta, Indonesia.",Gedung BRI,Jakarta,10210,2003-11-10
TEBE.JK,PT Dana Brata Luhur Tbk,ID1000152200,Industrial - Infrastructure Operations,Industrials,https://www.tebe.co.id,"PT Dana Brata Luhur Tbk, a coal logistic company, provides pit to port coal hauling services in Indonesia. The company operates hauling roads and stockpile areas. It also operates a coal terminal for coal loading and blending. The company was founded in 2008 and is headquartered in Jakarta, Indonesia. PT Dana Brata Luhur Tbk is a subsidiary of PT Prima Mineral Utama.",Treasury Tower,Jakarta,12190,2019-11-18
GUNA.JK,Gunanusa Eramandiri Tbk.,ID1000205008,Packaged Foods,Consumer Defensive,https://www.gunanusafood.com,"PT Gunanusa Eramandiri Tbk manufactures and sells nuts in Indonesia. It offers nuts, including almond, cashew, hazelnut, peanuts, and walnut, as well as nuts milk, nuts oil, and nuts snack. The company was founded in 1993 and is headquartered in Bekasi, Indonesia.",Delta Silicon Industrial Area,Bekasi,17530,2024-07-09
CNMA.JK,PT Nusantara Sejahtera Raya Tbk,ID1000193709,Entertainment,Communication Services,https://www.cinema21.co.id,"PT Nusantara Sejahtera Raya Tbk, together with its subsidiaries, engages in the movie screening and restaurant business in Indonesia. The company operates through five segments: Cinema, Food and Beverages, Advertisement, Digital Platform, Event and Other segments. It also offers management consulting; venue rental; organizing meeting, incentives, conferences, and exhibitions activities; and event services. In addition, the company provides food and beverages; cinema services; and land leasing services; as well as m.tix and TIX. ID which provides online ticketing platform services. The company was founded in 1988 and is headquartered in Jakarta Pusat, Indonesia. PT Nusantara Sejahtera Raya Tbk operates as a subsidiary of PT Harkatjaya Bumipersada.",Jl. KH Wahid Hasyim No.96A,Jakarta Pusat,10340,2023-08-02
HDIT.JK,PT Hensel Davest Indonesia Tbk,ID1000150303,Software - Infrastructure,Technology,https://www.hdi.co.id,"PT Hensel Davest Indonesia Tbk engages in the financial technology and electronic trading business in Indonesia. It offers application for digital product purchase, billing payment, ticket reservation, and store payment under the DavestPay brand. The company also provides artificial intelligence as a service in e-commerce platforms for business owners; and DoeKu, a platform that lends money in peer-to-peer lending market. In addition, it engages in information, communication, finance consulting, insurance, trading, and consulting businesses, as well as offers payment gateway and switching services. PT Hensel Davest Indonesia Tbk was founded in 2013 and is based in Makassar, Indonesia.",Gedung Graha Pena Lt 17 Kav. 1701,Makassar,90234,2019-07-12
CITA.JK,PT Cita Mineral Investindo Tbk,ID1000082803,Industrial Materials,Basic Materials,https://www.citamineral.com,"PT Cita Mineral Investindo Tbk engages in bauxite mining activities in Indonesia. The company was formerly known as PT Cipta Panel Utama Tbk and changed its name to PT Cita Mineral Investindo Tbk in May 2007. PT Cita Mineral Investindo Tbk was founded in 1992 and is headquartered in Jakarta Pusat, Indonesia. PT Cita Mineral Investindo Tbk is a subsidiary of PT Harita Jayaraya Inc.",Panin Bank Building,Jakarta Pusat,10270,2002-03-20
MYOR.JK,PT Mayora Indah Tbk,ID1000060007,Packaged Foods,Consumer Defensive,https://www.mayoraindah.co.id,"PT Mayora Indah Tbk, together with its subsidiaries, manufactures and sells food and beverage products in Indonesia, rest of Asia, and internationally. It operates through three segments: Packaged Food Processing, Packaged Beverages Processing, and Financial Services. The company offers biscuits under the Roma Sari Gandum, Roma Sari Gandum Sandwich, Marie Susu, Roma Marie Susu Gold, Roma Malkist, Roma Malkist Abon, Roma Malkist Coklat, Roma Cream Creakers, Roma Malkist Korean BBQ, Roma Malkist Krim Keju Manis, Roma kelapa, Roma Kelapa Cream, Roma Malkist Kelapa Kopyor, Roma Malkist Keju Tabur, Roma Malkist Cappuccino, Roma Sandwich, Roma Malkist Coklat Kelapa, Better, Roma Arden, Roma Sandwichi, Slai O Lai, Royal Choice, and other brands names; candies under the Kopiko, Kopiko Sugar Free, Kopiko Cappuccino, Kopiko Blister, Jae Jae, KIS, Tamarin, and other brand names; and wafers under the beng beng, beng beng Maxx, beng beng share it, Astor, Roma Wafer Coklat, Roma Zuperrr Keju, Roma Zuperrr Keju, Roma Crepes Roll Kelapa Wijen, Roma SuperStar, Roma Wafello, Kalpa, and other brand names. It also provides chocolates under the Choki-Choki and Drink Beng Beng brands; coffee under the Torabika Duo, Torabika Moka, Torabika Duo Susu Full Cream, Torabika Creamy Latte, Torabika Cappuccino, Torabika Diet, Torabika Jahe Susu, Torabika Natacinno, Torabika Gilus, Torabika 3 in 1, Kopiko Kopi Aren, Toracafe, ToraSusu, and Tora Flavacino brands, and health food products under the Energen Coklat, Energen Vanilla, Energen Jahe, Energen Kacang Hijau, Energen Jagung, Energen Kurma, Energen Oatmilk, and Prima Cereal brands. In addition, it is involved in the provision of financial services; and processing of coffee powder and instant coffee, and cacao beans. PT Mayora Indah Tbk was founded in 1977 and is headquartered in Jakarta, Indonesia.",Jl. Daan Mogot KM. 18,Jakarta,,2000-11-22
TKIM.JK,PT Pabrik Kertas Tjiwi Kimia Tbk,ID1000060403,"Paper, Lumber & Forest Products",Basic Materials,https://www.tjiwi.co.id,"PT Pabrik Kertas Tjiwi Kimia Tbk manufactures and sells paper products in Indonesia. It operates through Cultural Paper Products, Industrial Paper Products, and Other. The company provides white grade paper products, such as printing and writing, woodfree, photocopy, carbonless, grease proof, kraft, and drawing papers, as well as brief cards; brown white grade paper products, including medium fluting and test liner products, as well as core boards; and stationery products that comprise writing product spirals, pads, loose leaves, hardcover books, envelops, register rolls, plotters, and computer papers. It also offers single and double wall, and layer and partition carton boxes; and packaging products, which include single face packaging, food wrap, map and name card, and folding box products. In addition, the company provides chemical products comprising sodium hypochlorite, hydrochloric acid, chlorine liquid, calcium chloride, and caustic soda liquid and flake products. It also exports its products to other Asia, Africa, the Middle East, the United States, Europe, and internationally. The company was founded in 1972 and is based in Jakarta, Indonesia. PT Pabrik Kertas Tjiwi Kimia Tbk is a subsidiary of PT Purinusa Ekapersada.",Sinar Mas Land Plaza,Jakarta,10350,2000-11-28
DAYA.JK,PT Duta Intidaya Tbk,ID1000137300,Specialty Retail,Consumer Cyclical,https://www.watsons.biz.id,"PT Duta Intidaya Tbk operates as a health and beauty retailer in Indonesia. The company offers medicines, pharmacy goods, medical and wellness equipment, personal and skin care products, perfumes and cosmetics, baby products, and general merchandise in stores and/or pharmacies. It also trades in food and beverages. In addition, the company acts as an agent/representative, sole agent, distributor, and purveyor, as well as a franchise and supplier of various traded goods. As of December 31, 2021, the company operated a network of 160 stores in 14 provinces under the Watsons brand. It also operates online stores at Shopee.com, Tokopedia. com, Lazada.com, Blibli.com, and Bukalapak.com marketplace, as well as Halodoc, Bima+ app, Good Doctor app, GrabMart app, and GoMart app. The company was founded in 2005 and is based in South Jakarta, Indonesia. PT Duta Intidaya Tbk is a subsidiary of Total Alliance Holdings Limited.",EightyEight@Kasablanka Tower A,South Jakarta,12870,2016-06-28
BBRM.JK,PT Pelayaran Nasional Bina Buana Raya Tbk,ID1000126204,Marine Shipping,Industrials,https://www.bbr.co.id,"PT Pelayaran Nasional Bina Buana Raya Tbk, a shipping company, provides marine logistics services in Indonesia. It operates in two segments, Tug and Barge Vessel, and Offshore Support Vessel. The company offers transportation services for various bulk mining materials, such as coal, granite, and sand for the transshipment or delivery through rivers and coastal routes. As of December 31, 2021, it owned 2.5 set of tugs and barges, 1 self-propelled barge, and 3 offshore support vessels. The company also charters its vessels to oil and gas companies. PT Pelayaran Nasional Bina Buana Raya Tbk was incorporated in 1998 and is headquartered in Jakarta Pusat, Indonesia.",TCC Batavia Tower One,Jakarta Pusat,10220,2013-01-09
CASA.JK,PT Capital Financial Indonesia Tbk,ID1000137508,Insurance - Life,Financial Services,https://www.capitalfinancial.co.id,"PT Capital Financial Indonesia Tbk, together with its subsidiaries, provides financial and investment services in Indonesia. It also engages in the trade, industrial, construction, transportation, agriculture, printing, workshop, and service businesses; and insurance activities. The company was founded in 2009 and is based in Jakarta, Indonesia. PT Capital Financial Indonesia Tbk is a subsidiary of PT Capital Strategic Invesco.",Gedung Menara Jamsostek,Jakarta,12920,2016-07-19
APIC.JK,PT Pacific Strategic Financial Tbk,ID1000101009,Insurance - Life,Financial Services,https://www.apic.co.id,"PT Pacific Strategic Financial Tbk engages in investment and other management consultation activities primarily in Indonesia. The company also provides securities brokerage and underwriting services, as well as other services related to investment and capital markets; and financial management, factoring, and other financing services. In addition, it offers business consulting; and conventional and Sharia life insurance services. The company was formerly known as PT Pan Pacific International and changed its name to PT Pacific Strategic Financial Tbk in November 2010. PT Pacific Strategic Financial Tbk was founded in 1989 and is based in Jakarta Selatan, Indonesia.",Menara BPJAMSOSTEK (Utara) Lt. 12A,Jakarta Selatan,12710,2004-02-13
YUPI.JK,Yupi Indo Jelly Gum Tbk.,ID1000209802,Food Confectioners,Consumer Defensive,https://www.yupindo.com,"PT Yupi Indo Jelly Gum Tbk manufactures gummy candies worldwide. The company was founded in 2016 and is based in Jakarta Selatan, Indonesia. PT Yupi Indo Jelly Gum Tbk is a subsidiary of PT Sweets Indonesia.",Gedung Mugi Griya Lt 4,Jakarta Selatan,12810,2025-03-25
DNAR.JK,PT Bank Oke Indonesia Tbk,ID1000132301,Banks - Regional,Financial Services,https://www.okbank.co.id,"PT Bank Oke Indonesia Tbk provides various banking products and services in Indonesia. It offers current and saving accounts, demand, and time deposits, as well as certificates of deposit; and offers current account loans, working capital, investment, lines of credit, and consumer loans, such as mortgages and vehicle loans, as well as unsecured credit and payroll loans. The company also provides transfer of funds through RTGS and SKN; and ATM/debit, telephone payment, foreign exchange trading, safe deposit box leasing, and bank guarantee services, as well as internet/mobile banking services. It operates 14 branches. The company was founded in 1990 and is headquartered in Central Jakarta, Indonesia. PT Bank Oke Indonesia Tbk is a subsidiary of Apro Financial Co., Ltd.",Jl. Ir. H. Juanda No. 12,Jakarta Pusat,10120,2014-07-11
CSIS.JK,PT Cahayasakti Investindo Sukses Tbk,ID1000138704,Real Estate - Development,Real Estate,https://www.csis.co.id,"PT Cahayasakti Investindo Sukses Tbk engages in the real estate, furniture trading, and construction businesses. The company operates through three segments: Construction, Real Estate, and Others. It constructs residential, office, industrial, shopping, educational, lodging, entertainment and sports place, and other buildings, as well as highway, bridge and overpass, and railroad. The company also undertakes demolition; electronics installation; glass and aluminum installation; floor, wall, sanitary equipment, and ceiling; painting; and interior decoration works. In addition, it develops and sells land lots and building units; owns and leases tourism areas and industrial estates; and trades in furniture. The company was incorporated in 1995 and is headquartered in Bogor, Indonesia. PT Cahayasakti Investindo Sukses Tbk is a subsidiary of PT Andalan Utama Bintara.",Kawasan Industri Olympic - Hall 6,Bogor,16151,2017-05-10
PGJO.JK,PT Bahtera Bumi Raya Tbk,ID1000153208,Software - Application,Technology,https://www.pigijo.com,"PT Tourindo Guide Indonesia Tbk operates a digital travel marketplace. It offers tour packages, airline tickets, hotel tickets, and other services. The company was founded in 2017 and is headquartered in Jakarta Selatan, Indonesia.",Satrio Tower Building,Jakarta Selatan,12950,2020-01-20
BVIC.JK,PT Bank Victoria International Tbk,ID1000056302,Banks - Regional,Financial Services,https://www.victoriabank.co.id,"PT Bank Victoria International Tbk provides various banking products and services in Indonesia. It offers various savings accounts; demand, time, and forex deposits; current accounts; bank guarantees; and loan products, such as home and car ownership loan, multi-purpose credit, implant banking credit, and domestic letters of credit, as well as corporate and commercial lending, small medium enterprise lending, and multi finance lending products. The company also provides investment products; foreign exchange services, including remittance, trade finance, and treasury and other interbank services; and clearing/payment, transfer, real time gross settlement, bill payment, ATM, and internet and mobile banking services, as well as Sharia banking services. As of December 31, 2021, it operated through a network of 40 offices, which include 1 head office, 14 branch offices, and 25 sub-branch offices. The company was incorporated in 1992 and is headquartered in Jakarta Selatan, Indonesia.",Graha BIP Building,Jakarta Selatan,12930,2000-08-14
KARW.JK,PT Meratus Jasa Prima Tbk,ID1000079205,Marine Shipping,Industrials,http://www.meratusjasaprima.com,"PT Meratus Jasa Prima Tbk engages in the development and management of maritime logistics infrastructure and stevedoring services. It also involves in the general trading; freight forwarding, warehousing, and marine transportation; management, consultancy, and administration; and terminal and facilities management. The company was founded on February 18, 1978, and is headquartered in Jakarta, Indonesia.",Graha Kirana Building,Jakarta Utara,14350,2002-02-07
PEHA.JK,"PT Phapros, Tbk",ID1000147507,Drug Manufacturers - Specialty & Generic,Healthcare,https://www.phapros.co.id,"PT Phapros, Tbk operates in the pharmaceutical and health care industry in Indonesia. The company operates through Over the Counter (OTC), Ethical, Generic Drugs Bearing, and Toll Manufacturing segments. It offers OTC drugs, including Antimo Anak, Livron B Plek, Noza, Hemorogard, Bioron, and others. The company also provides generic drug products for government institutions and hospitals, as well as produces drugs for other pharmaceutical industries; and offers medical devices. PT Phapros, Tbk also exports its products internationally. The company was founded in 1954 and is headquartered in Jakarta, Indonesia. PT Phapros, Tbk operates as a subsidiary of PT Kimia Farma (Persero) Tbk.",Rajawali Tower 17th Floor,Jakarta,12950,2018-12-26
BATR.JK,Benteng Api Technic Tbk.,ID1000204308,Construction Materials,Basic Materials,https://bentengapi.com,"PT Benteng Api Technic Tbk engages in manufacturing, trading, engineering, and construction business in Indonesia. The company manufactures and sells bricks, refractory cement, and refractory materials, as well as fire clay bricks, high alumina brick, refractory mortar, refractory castable, gunning castable, and others. It also provides refractory, insulation, mechanical, fire brick installation; and refractory casting, ramming, and gunning works. The company serves iron and steel, aluminum and copper smelting, petrochemical and fertilizer, oil and gas, power generation, cement and lime, paper processing, food, palm oil/CPO, and other industries. PT Benteng Api Technic Tbk was founded in 1997 and is based in Surabaya, Indonesia.",Jl. Kebraon II No. 103 A,Surabaya,60222,2024-06-10
AKSI.JK,PT Mineral Sumberdaya Mandiri Tbk,ID1000070709,Rental & Leasing Services,Industrials,https://www.mesmineral.co.id,"PT Mineral Sumberdaya Mandiri Tbk, through its subsidiary, PT Rezki Batulicin Transport, engages in the land transportation business in Indonesia. It offers coal transportation services. The company is also involved in the rental of vehicles and trading business. It has 6 scania units, 59 dump truck units, 2 water tank units, and 20 units of Volvo double trailers. The company was formerly known as PT Maming Enam Sembilan Mineral Tbk. PT Mineral Sumberdaya Mandiri Tbk was founded in 1990 and is based in Jakarta Selatan, Indonesia. PT Mineral Sumberdaya Mandiri Tbk is a subsidiary of PT Batulicin Enam Sembilan Transportasi.",District 8 Treasury Tower Level 52,Jakarta Selatan,12190,2007-12-28
BNBA.JK,PT Bank Bumi Arta Tbk,ID1000103401,Banks - Regional,Financial Services,https://www.bankbba.co.id,"PT Bank Bumi Arta Tbk provides banking products and services in Indonesia. The company provides savings, call, and term deposits; and business financing solutions, including account, fixed, demand, housing, car ownership, pension, term, multipurpose, export and import financing, and investment loans. In addition, it offers bank guarantee and payment services; ATM, and internet and mobile banking services; and other services, such as bank notes, corporate payroll, financial supply chain, and bank drafts. As of December 31, 2021, the company operated a network of 11 branches, 16 sub-branches, and 15 ATM machines in Indonesia. PT Bank Bumi Arta Tbk was founded in 1967 and is headquartered in Jakarta Pusat, Indonesia.",Jl. Wahid Hasyim No. 234,Jakarta Pusat,10250,2006-06-01
NFCX.JK,PT NFC Indonesia Tbk,ID1000144504,Internet Content & Information,Communication Services,https://www.ptnfc.com,"PT NFC Indonesia Tbk provides digital products and services in Indonesia. The company operates through Digital Product Aggregator, Digital Cloud Advertisement, Clean Energy Products and Services, Digital Wholesale, and Integrated Content and Entertainment segments. It operates Refira and M-Coupon platforms designed for prompting sale; DMMX, a cloud marketing and advertising platform that provides digital cloud marketing ecosystem solution through hardware and content management system, as well as manages service contracts; and film and media analytic platform that offers moviegoers a rating system for new movie release for local and international films. The company also provides digital marketing services, such as creative campaign, performance marketing, and social media analytics; and production and investment for film and movies. In addition, it offers digital cloud advertising, online media, advertising, entertainment, radio broadcasting, telecommunication trading, and news publishing services. Further, the company manages online channels, retail, and banking market segmentation. Additionally, it engages in trade, development, industry, services, printing, construction, land transportation, application development, and agriculture businesses; and machine, equipment, computer programming, web portals, digital platforms, and information technology and other computer services, as well as trades in communication devices. The company was founded in 2013 and is based in Jakarta Selatan, Indonesia. PT NFC Indonesia Tbk operates as a subsidiary of PT M Cash Integrasi Tbk.",Mangkuluhur City Tower 1,Jakarta Selatan,12930,2018-07-12
GOOD.JK,PT Garudafood Putra Putri Jaya Tbk,ID1000145907,Packaged Foods,Consumer Defensive,https://www.garudafood.com,"PT Garudafood Putra Putri Jaya Tbk engages in the manufacture and wholesale trade of food and beverages in Indonesia and internationally. It operates through three segments: Packaged Foods, Beverages, and Others. The company offers biscuits, shelled peanuts, coated peanuts, pilus and pellet snacks, snacks made from potatoes and corn, chocolates, confectioneries, potato crisp, and milk and chocolate drinks, as well as processed cheddar cheese and salad dressing. It offers its products under the brands Garuda, Grey, Chocolatos, Leo, Clavo, Prochiz, and Top Chiz. The company also sells its products through depots, and sub-distributors and agents, as well as e-commerce platform. It serves wholesalers, modern stores, traditional stores/retail stores, and institutions. The company was founded in 1958 and is headquartered in Jakarta Selatan, Indonesia. PT Garudafood Putra Putri Jaya Tbk is a subsidiary of PT Tudung Putra Putri Jaya.",Wisma Garudafood,Jakarta Selatan,12240,2018-10-10
MTPS.JK,PT Meta Epsi Tbk.,ID1000148307,Engineering & Construction,Industrials,https://www.metaepsi.com,"PT Meta Epsi Tbk. provides engineering, procurement, and construction services to customers in the areas of power and industrial generation, transmission, distribution, oil and gas, and infrastructure. The company also offers project management, procurement, construction and commissioning, and project development services. The company was founded in 1975 and is headquartered in Jakarta, Indonesia.",Meta Epsi Building,Jakarta,13350,2019-04-10
TRUS.JK,PT Trust Finance Indonesia Tbk,ID1000134901,Financial - Credit Services,Financial Services,https://www.trustfinanceindonesia.com,"PT Trust Finance Indonesia Tbk provides financing services in Indonesia. It offers investment financing services, including financing of heavy equipment, trucks, digital printing and printing machines, industrial machineries, and medical devices. The company also provides working capital financing solutions comprising sale and lease back, factoring, and business capital facilities. In addition, it offers financing for houses and apartments, cars, motorcycles, education, and tour/travel expenses, as well as for the purchase of household appliances and other consumptive products. The company was formerly known as PT KIA Asia Finance and changed its name to PT Trust Finance Indonesia Tbk in February 2002. PT Trust Finance Indonesia Tbk was founded in 1990 and is headquartered in Jakarta, Indonesia.",Gedung Artha Graha,Jakarta,12190,2002-11-28
