symbol,companyName,isin,industry,sector,website,description,address,city,zip,ipoDate
PSDN.JK,PT Prasidha Aneka Niaga Tbk,ID1000090400,Packaged Foods,Consumer Defensive,https://www.prasidha.co.id,"PT Prasidha Aneka Niaga Tbk, together with its subsidiaries, engages in the processing and trading of agricultural products in Indonesia. It offers crumb rubber; and produces instant and roasted ground coffee products, and coffee beans. The company is also involved in the coffee plantation. It also exports crumb rubber to the United States, Europe, and Japan. The company was formerly known as PT Aneka Bumi Asih and changed its name to PT Prasidha Aneka Niaga Tbk in 1994. PT Prasidha Aneka Niaga Tbk was founded in 1974 and is headquartered in Jakarta, Indonesia.",Plaza Sentral,Jakarta,12930,2003-04-24
DEWA.JK,PT Darma Henwa Tbk,ID1000107303,Coal,Energy,https://www.ptdh.co.id,"PT Darma Henwa Tbk, together with its subsidiaries, engages in mining support and other excavation activities, and machine repair for special purposes in Indonesia. It operates through two segments, Mining Services and Other Services. The company is involved in various mining activities, including land clearing, top soiling, drilling, blasting, overburden removal and dumping, coal getting, coal rom, coal hauling, coal crushing, coal barging, vegetation, and rehabilitation activities, as well as engages in rental and operating lease and civil engineering businesses. It also engages in road and bridge construction for mining areas, mining dressing plant installation, earthworks, drilling exploration, and civil consultant management activities. In addition, the company provides port management services comprising operational activities for the coal crushing and blending process, coal stockpile management service at the port, maintenance of power plants and the supporting equipment, port equipment maintenance service, and other services. The company was formerly known as PT HWE Indonesia and changed its name to PT Darma Henwa Tbk in September 2005. PT Darma Henwa Tbk was incorporated in 1991 and is headquartered in Jakarta, Indonesia.",Bakrie Tower,Jakarta,12940,2007-09-26
MTSM.JK,PT Metro Realty Tbk,ID1000121007,Real Estate - Services,Real Estate,https://www.ptmetrorealty.co.id,"PT Metro Realty Tbk engages in the lease and property management, investment, and real estate development businesses in Indonesia. It operates apartment buildings; residential buildings; and non-living quarters, such as exhibition venues, private storage facilities, malls, shopping centers, and others, as well as provides houses and flats or apartments with or without furniture. The company was formerly known as PT Metro Supermarket Realty Tbk and changed its name to PT Metro Realty Tbk in July 2009. PT Metro Realty Tbk was founded in 1980 and is based in Jakarta Pusat, Indonesia.",Gedung Metro Pasar Baru,Jakarta Pusat,10710,2003-01-06
ARII.JK,PT Atlas Resources Tbk,ID1000121205,Coal,Energy,https://www.atlas-coal.co.id,"PT Atlas Resources Tbk, together with its subsidiaries, engages in the acquisition, exploration, development, production, and sale of coal in Indonesia and internationally. It produces high-calorie and metallurgical coal for use in the steel production and power plants, cement factories, and other manufacturing facilities. The company holds various mining concessions covering a total area of approximately 50,000 hectares in Indonesia. It is also involved in the trading, services, construction, transportation, workshop, printing, investment, logistics, and agricultural activities. The company was founded in 2007 and is based in Jakarta Selatan, Indonesia.",Sampoerna Strategic Square,Jakarta Selatan,12930,2011-11-08
META.JK,PT Nusantara Infrastructure Tbk,ID1000116304,Industrial - Infrastructure Operations,Industrials,https://www.nusantarainfrastructure.com,"PT Nusantara Infrastructure Tbk, together with its subsidiaries, operates and manages toll roads in Indonesia. The company operates through six segments: Toll Road Management Services, Investment, Ports, Water, Energy, and Telecommunications Towers. It also engages in the clean water treatment, management, and distribution activities; renewable energy business; provision of port management services, including warehousing, loading and unloading, and storage tank rental services; construction and operation of dry and liquid cargo terminals; and telecommunication and trading business. The company was formerly known as PT Metamedia Technologies Tbk and changed its name to PT Nusantara Infrastructure Tbk in June 2006. PT Nusantara Infrastructure Tbk was founded in 1995 and is headquartered in Jakarta, Indonesia. PT Nusantara Infrastructure Tbk is a subsidiary of PT Metro Pacific Tollways Indonesia.",Equity Tower,Jakarta,12190,2005-10-17
OASA.JK,PT Maharaksa Biru Energi Tbk,ID1000137607,Engineering & Construction,Industrials,https://maharaksabiru.com,"PT Maharaksa Biru Energi Tbk, an investment holding company, engages in the construction and renewable energy businesses in Indonesia. The company provides water treatment, waste management, and waste material disposal services. It is also involved in the waste material processing and recovery, and remediation activities. In addition, the company engages in construction of buildings and civil structures; collection, treatment, and disposal of waste and rubbish, as well as material recovery activities; wholesale trading business; and procurement of electricity. Further, it offers accommodation, and food and beverages; real estate, general trading, mining and digging, transportation and warehousing, forestry and fishery, financial, and insurance services; and engages in the supplying of electricity, gas, steam/hot water, and air conditioning. The company was formerly known as PT Protech Mitra Perkasa Tbk and changed its name to PT Maharaksa Biru Energi Tbk in October 2022. PT Maharaksa Biru Energi Tbk was founded in 2006 and is headquartered in Jakarta Selatan, Indonesia.",Treasury Tower,Jakarta Selatan,12190,2016-07-18
WSKT.JK,PT Waskita Karya (Persero) Tbk,ID1000126105,Engineering & Construction,Industrials,https://www.waskita.co.id,"PT Waskita Karya (Persero) Tbk, together with its subsidiaries, engages in the engineering, procurement, and construction (EPC) works in Indonesia. It undertakes building projects, airports, regional development projects; civil non-road and bridge infrastructure projects, such as dams, water structures, ports, and others; and road and bridge civil infrastructure projects, including roads, bridges, LRT, railways, and others. The company also engages in the EPC projects comprising power plants, industrial plants, smelters, water transmission and distribution, electricity, oil and gas, and others. In addition, it is involved in the hotel management business; building and equipment rental business; and production of precast concrete. Further, the company builds, operates, and invests in various toll roads; and develops real estate properties, as well as operates power plants. PT Waskita Karya (Persero) Tbk was founded in 1961 and is headquartered in Jakarta, Indonesia.",Gedung Waskita Heritage,Jakarta,13340,2012-12-19
AGII.JK,PT Samator Indo Gas Tbk,ID1000137805,Chemicals,Basic Materials,https://www.samatorgas.com,"PT Aneka Gas Industri Tbk produces, markets, and sells industrial gases in Indonesia. The company offers air gases, including oxygen, nitrogen, and argon; mixed and specialty gases comprising sulfur hexafluoride, pure gas, sterilization gas, compressed natural, environmental calibration, and exhaust emissions engine gases; synthetic gases, such as hydrogen, carbon monoxide, and sulfur dioxide; medical oxygen gas, consists nitrous oxide gas, air gas, nitrogen gas, carbon dioxide, helium, lung function mix gases, calibration gas for blood analysis, and cryopreservation gas; and hydrocarbon gases, such as propane, natural, and liquid petroleum gas, as well as acetylene; and other gases includes ammonia, samator fuel gas, and krypton, neon, and xenon rare atmospheric gases. It also provides medical supply equipment, medical gas monitoring systems, onsite gas systems, gas handling and cutting equipment, and modular operating theatre products, as well as installation services. The company operates approximately 100 filling stations. PT Aneka Gas Industri Tbk was founded in 1916 and is headquartered in Jakarta Selatan, Indonesia.","Gedung UGM Samator Pendidikan, Tower A",Jakarta Selatan,12850,2016-09-28
MFIN.JK,PT Mandala Multifinance Tbk,ID1000102304,Financial - Credit Services,Financial Services,https://mandalafinance.com,"PT Mandala Multifinance Tbk engages in the consumer financing activities in Java, Sumatera, Sulawesi, and Kalimantan in Indonesia. It provides motorcycle consumer financing services based on conventional and sharia financing, as well as electronic and furniture, and multipurpose financing services. The company was formerly known as PT Gracia Dinamika Multifinance and changed its name to PT Mandala Multifinance Tbk in March 1997. The company was founded in 1983 and is based in Central Jakarta, Indonesia. PT Mandala Multifinance Tbk is a subsidiary of PT Jayamandiri Gemasejati.",Jalan Menteng Raya No. 24 A-B,Jakarta Pusat,10340,2005-09-06
BACA.JK,PT Bank Capital Indonesia Tbk,ID1000107402,Banks - Regional,Financial Services,https://www.bankcapital.co.id,"PT Bank Capital Indonesia Tbk provides various banking products and services in Indonesia. The company offers current accounts, savings products, and time deposits; mortgage, car, and multipurpose financing products; overdraft facilities; demand loans, money market lines, and term loans; and guarantees. It also provides safe deposit boxes, ATM cards, online fund transfers, collection, clearing, foreign exchange, export and import transaction, remittance, payroll, syndicated loans, online and mobile banking, and credit card payment services. It operates through 4 branches and 77 sub-branches. The company was formerly known as PT Bank Credit Lyonnais Indonesia and changed its name to PT Bank Capital Indonesia Tbk in September 2004. PT Bank Capital Indonesia Tbk was founded in 1989 and is headquartered in Jakarta Selatan, Indonesia.",Jamsostek Tower,Jakarta Selatan,12710,2007-10-04
SUPR.JK,PT Solusi Tunas Pratama Tbk,ID1000120702,Communication Equipment,Technology,https://stptower.com,"PT Solusi Tunas Pratama Tbk operates as an independent tower company in Indonesia. It operates through two segments, Tower Rental and Other Services. The company manages and leases base transceiver station (BTS) towers. It operates greenfield and rooftop telecommunication towers, including four-legged supporting towers, three-legged self-supporting towers, camouflage towers, monopoles, and roof top towers, as well as mobile BTS. The company was founded in 2006 and is headquartered in Jakarta, Indonesia. As of October 1, 2021, PT Solusi Tunas Pratama Tbk operates as a subsidiary of PT Profesional Telekomunikasi Indonesia.",Perkantoran Permata Senayan Blok C1,Jakarta,12210,2011-10-11
BTPS.JK,PT Bank BTPN Syariah Tbk,ID1000142805,Banks - Regional,Financial Services,https://www.btpnsyariah.com,"PT Bank BTPN Syariah Tbk provides various banking products and services in Indonesia. It offers funding, financing, bills payment, air-time purchase, fund transfer, cash deposit, and cash withdrawal services. The company also provides mobile banking, savings, and ATM services. It operates through a network of 23 branch offices, 42 operational functional offices, 3 non-operational functional offices, 5 sharia bank services, and 9 ATMs. The company was formerly known as PT Bank Tabungan Pensiunan Nasional Syariah Tbk.PT Bank BTPN Syariah Tbk was founded in 1991 and is headquartered in Jakarta Selatan, Indonesia. PT Bank BTPN Syariah Tbk is a subsidiary of PT Bank BTPN Tbk.",Menara BTPN,Jakarta Selatan,12950,2018-05-08
CNTX.JK,PT Century Textile Industry Tbk,ID2000081902,Apparel - Manufacturers,Consumer Cyclical,https://www.toray.co.id/centex,"PT Century Textile Industry Tbk engages in the textile business in Indonesia, Bangladesh, the Kingdom of Saudi Arabia, Asia, the United Arab Emirates, the Middle East, the Netherlands, the Euro-zone countries, Northern America, and internationally. The company engages in the spinning, weaving, and dyeing and finishing of cloths. It offers TC and CVC plain and dobby fabrics, and oxford fabrics for producing shirts and uniforms. PT Century Textile Industry Tbk was founded in 1970 and is based in Jakarta Timur, Indonesia.",Jalan Raya Bogor Km. 27,Jakarta Timur,13740,2002-04-18
LABS.JK,UBC Medical Indonesia Tbk.,ID1000205305,Medical - Equipment & Services,Healthcare,https://www.ubcindonesia.com,"PT UBC Medical Indonesia Tbk distributes medical devices in Indonesia. It operates in two segments, Medical Disposables and Consumables, and Diagnostics and Equipment. The company offers next generation molecular, retina AI, infectious disease, HPV DNA test, real time PCR, TB management, and newborn screening products. PT UBC Medical Indonesia Tbk was founded in 2014 and is based in Jakarta Timur, Jakarta. PT UBC Medical Indonesia Tbk operates as a subsidiary of PT Optel Investama Mulia.",Etana Building,Jakarta Timur,,2024-07-10
PTPP.JK,PT PP (Persero) Tbk,ID1000114002,Engineering & Construction,Industrials,https://www.ptpp.co.id,"PT PP (Persero) Tbk operates as a construction and investment company in Indonesia. The company operates through Construction; Engineering, Procurement, and Construction (EPC); Property and Realty; Precast; Equipment Rent Service; and Energy segments. It develops high-rise buildings, roads and bridges, dams and irrigation projects, ports, airports, and power plants; and develops, constructs, and operates commercial buildings, hotels, apartments, offices, settlements, shopping centers, trade centers, residential properties, and other facilities. The company also provides EPC services focusing on energy, oil and gas, mining, and manufacturing sectors; provides building management, lease, and management consulting services; and manufactures and sells precast concrete. In addition, it engages in the trading, electricity supply, oil and gas exploration and production, telecommunication, water treatment, transportation, toll road concession, agriculture, printing, workshop, animal husbandry, plantation, forestry, and building materials businesses. PT PP (Persero) Tbk was incorporated in 1953 and is headquartered in Jakarta, Indonesia.",Plaza PP - Wisma Subiyanto,Jakarta,13760,2010-02-09
TBIG.JK,PT Tower Bersama Infrastructure Tbk,ID1000116908,Telecommunications Services,Communication Services,https://www.tower-bersama.com,"PT Tower Bersama Infrastructure Tbk, together with its subsidiaries, provides telecommunication infrastructure space for installation of telecommunication equipment in Indonesia. It leases space for antennas and other equipment for wireless signal transmission at tower sites with telecommunications operators. The company also provides telecommunications operators with access to its distributed antennae system (DAS) networks in shopping malls and office buildings in urban areas. As of December 31, 2021, it had 39,088 tenants; and 20,578 telecommunications sites comprising 20,466 telecommunications towers and 112 DAS networks. The company was formerly known as PT Banyan Mas. PT Tower Bersama Infrastructure Tbk was founded in 2004 and is headquartered in Jakarta Selatan, Indonesia.",The Convergence Indonesia,Jakarta Selatan,12940,2010-10-26
ALII.JK,Ancara Logistics Indonesia Tbk,ID1000202807,Marine Shipping,Industrials,http://ancaralogistics.co.id,"PT Ancara Logistics Indonesia Tbk provides sea transportation, transshipment and logistics services. Its main activity is managing the transportation of coal using barges and in its business activities the company is supported by the required permits and certifications such as SIUPAL (Sea Transport Company Business Permit), ISM (International Safety Management) Code and ISPS (International Ship and Port Facility Security) Code. The company was founded on July 30, 2019 and is headquartered in Jakarta Selatan, Indonesia.",Bakrie Tower,Jakarta Selatan,,2024-02-07
AMIN.JK,PT Ateliers Mecaniques D'Indonesie Tbk,ID1000136302,Industrial - Machinery,Industrials,https://www.atmindoboiler.com,"PT Ateliers Mecaniques D'Indonesie Tbk designs, manufactures, and erects boilers in Indonesia, Nigeria, Cameroon, the Republic of Cote D'Ivoire, Congo, Saotoma and Principe, Belgium, and Liberia. The company offers solid fuel membrane wall boilers, solid fuel brick wall boilers, combi boilers, and firetube boilers. It also provides horizontal and vertical sterilizers; and sterilizer doors, as well as deaerators for use in the removal of air and other dissolved gases primarily oxygen from the feed water to boiler drum. In addition, the company provides air-preheater, a heat recovery equipment; economizer that is used to enhance boiler operation efficiency; and superheater, which converts wet saturated steam into dry steam, as well as dust collectors. Further, it designs and fabricates pressure vessel tanks, piping systems, and boilers for the palm oil industry. Additionally, the company is involved in the trade and assembly of a range of machinery, plant construction, and repair and maintenance services, as well as agency and marketing activities. It serves palm oil mill, sugar mill, refinery, rubber processing, power plant, power generation, wood processing, chocolate factory, hotel, laundry, textile factory, and plastic factory industries. The company was founded in 1972 and is headquartered in Deli Serdang, Indonesia. PT Ateliers Mecaniques D'Indonesie Tbk is a subsidiary of Sphere Corporation Sdn Bhd.","Jalan Sei Belumai Km. 2,4",Deli Serdang,20362,2015-12-10
PBID.JK,PT Panca Budi Idaman Tbk,ID1000141401,Packaging & Containers,Consumer Cyclical,https://www.pancabudi.com,"PT Panca Budi Idaman Tbk manufactures, distributes, and trades in plastic packaging items. The company operates through Plastic Packaging, Plastic Resins, and Others segments. It provides polyethylene and polypropylene bags; high density polyethylene resins; and heavy-duty sacks, as well as packaging products, such as food wrapping papers, cake boxes, plastic ropes, rubber bands, and straws. The company also sells recycled resins, shrink packaging, woven bags, raffia strings, and rice papers. It distributes its products to retail merchants, semi-wholesalers, and wholesalers. The company provides its products under the Pluit, Tomat, Bangkuang, Jeruk, Cabe, 222, Wayang, Gapura, Sparta, Liberty, Dayana, PB, and various other brand names. It exports its products to the United Kingdom, Germany, the Netherlands, Spain, the United Arab Emirates, Nigeria, the United States, Taiwan, etc. The company was founded in 1979 and is headquartered in Tangerang, Indonesia. PT Panca Budi Idaman Tbk is a subsidiary of PT Alphen Internasional Corporindo.",Kawasan Pusat Niaga Terpadu,Tangerang,15122,2017-12-13
PANR.JK,PT Panorama Sentrawisata Tbk,ID1000109705,Travel Services,Consumer Cyclical,https://www.panorama-sentrawisata.com,"PT Panorama Sentrawisata Tbk engages in tourism businesses primarily in Indonesia. It operates through three segments: Travel, Transportation Services, and Convention Services. The company offers overland and round-trip tours, coach and rental, free and easy programs, stopover programs, adventure tours, special interest programs, e-commerce, and incentive groups to provide tailor made itineraries services; leisure tour, corporate travel, and incentive tour management services; and travel licensee and individual travel agent programs. It also offers media pillar services, such as event and exhibition organizer for meetings, incentives, conventions, and exhibitions activities; live entertainment for music, theater, and other on-stage performances; and publishes travel magazine and books. In addition, the company provides premium bus charters, intercity shuttles, tourism buses, and open trip services. PT Panorama Sentrawisata Tbk was founded in 1995 and is headquartered in Jakarta Barat, Indonesia. PT Panorama Sentrawisata Tbk is a subsidiary of PT Panorama Tirta Anugerah.",Gedung Panorama,Jakarta Barat,11440,2001-09-19
WSBP.JK,PT Waskita Beton Precast Tbk,ID1000137706,Construction Materials,Basic Materials,https://web.waskitaprecast.co.id,"PT Waskita Beton Precast Tbk engages in the manufacture and sale of precast and ready-mix concrete in Indonesia. It operates through Precast Concrete, Ready Mix & Quarry Concrete, and Construction Services segments. The company provides girders, spun and square piles, concrete barriers, U and L-gutters, U-ditches, box culverts, pile caps, diaphragm walls, spider web foundations, CCSPs and FCSPs, pier head precast, full and half slabs, deck and voided slabs, RC Pipes, sprigWP, railway sleepers, electric poles, facades, precast column blocks, and tetra pods. It also offers supporting services comprising engineering, installation, piling, construction, and posttensioning services. The company was founded in 2013 and is headquartered in Jakarta Timur, Indonesia. PT Waskita Beton Precast Tbk is a subsidiary of PT Waskita Karya (Persero) Tbk.",Teraskita Building,Jakarta Timur,13340,2016-09-20
UNSP.JK,PT Bakrie Sumatera Plantations Tbk,ID1000099708,Agricultural Farm Products,Consumer Defensive,https://www.bakriesumatera.com,"PT Bakrie Sumatera Plantations Tbk, together with its subsidiaries, engages in the plantation, processing, and trading of agricultural and industrial products in Indonesia. The company operates in three segments: Palm Oil and Derivatives, Rubber, and Oleochemical. The Palm Oil and Derivatives segment processes, markets, and sells palm oil, as well as develops and maintains palm oil. Its palm oil derivative products and palm kernel oil are used in food and non-food industries, including cooking oil, margarine, ice creams, soaps and detergents, animal feeds, cosmetics, industrial lubricants, and bio-fuels. The Rubber segment processes, markets, and sells natural rubber products for use in footwear, gloves, contraceptives, and other industries, as well as develops and maintains rubber. The Oleochemical segment processes, markets, and sells oleochemicals that are used as raw materials for various fast moving consumer goods. The company also provides financial services for issuing bonds; and industrial estate management services, as well as processes fatty acids and distillate, fatty alcohols, glycerin, and palm stearin and olein. It also exports its products. The company was formerly known as United Sumatera Plantations and changed its name to PT Bakrie Sumatera Plantations Tbk in 1991. PT Bakrie Sumatera Plantations Tbk was founded in 1911 and is headquartered in Kisaran, Indonesia.",Jl. H. Juanda,Kisaran,21202,2004-11-04
CASH.JK,PT Cashlez Worldwide Indonesia Tbk,ID1000155906,Business Equipment & Supplies,Industrials,https://www.cashlez.com,"PT Cashlez Worldwide Indonesia Tbk provides digital financial technology and payment services in Indonesia. The company offers Cashlez Pay, a payment system feature that could process various types of non-cash payments offline and online; Cashlez Reporting, a feature for monitoring various merchant business transactions; and Cashlez mPOS, a POS application feature that could be used by business actors to manage sales and business transactions. It also provides Cashlez One, an Android-based device that could process various types of payments, including swipe and dip cards, as well as online payments; and Cashlez Reader Non-Printer and Cashlez Reader Printer, which are security tools for accepting various non-cash transaction methods from debit cards and credit cards, as well as online payments. The company was founded in 2015 and is headquartered in Jakarta Barat, Indonesia.",Garden Shopping Avenue B/08/BA,Jakarta Barat,11470,2020-05-04
MGRO.JK,PT Mahkota Group Tbk,ID1000144603,Packaged Foods,Consumer Defensive,https://www.mahkotagroup.com,"PT Mahkota Group Tbk engages in the palm oil processing and its derivatives businesses in Indonesia. It operates through two segments, Palm Oil and Logistics. The company produces palm kernel, crude palm oil (CPO), refined bleached deodorized palm oil, fatty acid distilated, and palm kernel oil and expeller products. It also provides tank rental services for liquid bulk product storage, such as liquid chemicals, CPO, etc. The company was founded in 2011 and is headquartered in Medan, Indonesia. PT Mahkota Group Tbk is a subsidiary of Pt Mahkota Global Investama.",Grand Jati Junction Complex Lt.27,Medan,20231,2018-07-12
IRRA.JK,PT Itama Ranoraya Tbk,ID1000151707,Medical - Distribution,Healthcare,https://www.itama.co.id,"PT Itama Ranoraya Tbk engages in the procurement of health goods in Indonesia. It offers non-electromedical sterile medical devices, in vitro diagnostic products, and other products. The company's products include ADS syringes, blood screening machines and reagents, apheresis machines, blood processing machines, rapid test products, vaccine refrigerators, masks, products for surgery in hospitals, ultrasound, and health supplements. It is also involved in building and office space rental business. The company was founded in 1988 and is headquartered in Jakarta Timur, Indonesia. PT Itama Ranoraya Tbk is a subsidiary of PT Global Dinamika Kencana.",MT. Haryono Square,Jakarta Timur,13330,2019-10-15
