symbol,companyName,isin,industry,sector,website,description,address,city,zip,ipoDate
AADI.JK,PT Adaro Andalan Indonesia,ID1000207509,Coal,Energy,https://adaroindonesia.com/,PT Adaro Andalan Indonesia Tbk (“Company”), established in 2004, is a holding company that oversees subsidiaries engaged in coal mining, mining services, other management consulting activities, water resources management, electricity, special freight services, oil palm plantations, rubber plantations and other latex-producing plants, with operational areas including South Kalimantan, South Sumatra, and Central Kalimantan. The business model of the Company and its subsidiaries (“Group”) includes a supply chain with coal mines as the starting point of operations to power plants as the end point of its vertical integration.,Cyber 2 Tower Lantai 26 Jl. H.R. Rasuna Said Blok X-5, No.13,Jakarta,12920,2024-12-05
BINO.JK,PT Perma Plasindo Tbk,ID1000164403,Business Equipment & Supplies,Industrials,https://www.permaplasindo.co.id,"PT Perma Plasindo Tbk, through its subsidiaries, manufactures and distributes office equipment in Indonesia. The company offers office stationery products under the Bantex, Elba, Linex, APLI, Oxford, and XYRON brands; school stationery products under the LYRA, GIOTTO, and Milan brands; stationery fine arts and crafts under the Canson Paper, COPIC Marker, and DAS brands; and general stationery products under the Paper HVS Sinar Dunia, Globe, Paperline, and Paperline Gold brands. It is also involved in the wholesale and trading of chemical, such as industrial glue under the Stck-O brand; and information technology activities. The company was founded in 1992 and is based in North Jakarta, Indonesia.",Jl. Raya Boulevard,Jakarta Utara,14240,2021-11-25
BRIS.JK,PT Bank Syariah Indonesia Tbk,ID1000142904,Banks - Regional,Financial Services,https://www.bankbsi.co.id,"PT Bank Syariah Indonesia Tbk provides various commercial banking products and services in Indonesia. The company operates through five segments: Wholesale, Small and Medium Enterprise (SME), Consumer, Micro, and Others. It offers banking products and services that include savings, demand deposits, and time deposits; micro financing; working capital and investment financing; and internet banking services. The company also provides movable or immovable goods lease financing; debit and financing cards; buying, selling, and guaranteeing third party securities; money transfer and custody services; letters of credit; bank guarantee facilities; and trustee, safekeeping, and foreign exchange services. In addition, it publishes, offers, and trades in short and long term securities. As of December 31, 2021, the company operated through a network of 272 branch offices, 972 sub-branch offices, and 74 cash offices. The company was founded in 1969 and is headquartered in South Jakarta, Indonesia. PT Bank Syariah Indonesia Tbk is a subsidiary of PT Bank Mandiri (Persero) Tbk.",The Tower Building,Jakarta Selatan,12930,2018-05-09
RAJA.JK,PT Rukun Raharja Tbk,ID1000094105,Regulated Gas,Utilities,https://www.raja.co.id,"PT Rukun Raharja Tbk, together with its subsidiaries, operates as an integrated energy provider in Indonesia. It is involved in the distribution and storage of natural gas and fuel; maintenance and operations of clean water, gas infrastructure, and compression, as well as management of LPG terminal facilities. The company also offers supporting services for oil and natural gas mining; consultations on energy and mining; port services; containers loading-unloading services; leasing and management of building; supporting utilities of property companies; and planning and construction supervision services. In addition, it is involved fuel and gas transmission pipeline capacity trading. The company was founded in 1993 and is headquartered in Jakarta Pusat, Indonesia.",Office Park Thamrin Residences,Jakarta Pusat,10220,2003-01-22
ACES.JK,PT Aspirasi Hidup Indonesia Tbk,ID1000125503,Specialty Retail,Consumer Cyclical,https://ahi.id,"PT Ace Hardware Indonesia Tbk, together with its subsidiaries, engages in the retail of household appliances and lifestyle products in Indonesia. It operates through Home Improvement Products, Lifestyle Products, and Toys Products segments. As of December 31, 2021, it operated 216 retail outlets located in Jakarta, Tangerang, Cilegon, Bekasi, Karawang, Bogor, Depok, Cirebon, Bandung, Sumedang, Tasikmalaya, Gresik, Yogyakarta, Semarang, Solo, Purwokerto, Tegal, Surabaya, Malang, Jember, Kediri, Madiun, Aceh, Bali, Medan, Batam, Padang, Pekan Baru, Palembang, Jambi, Bengkulu, Lampung, Balikpapan, Makassar, Banjarmasin, Pontianak, Manado, Maluku, Samarinda, Kupang, Lombok, Kendari, Pangkal Pinang, Mojokerto, Gorontalo, and Riau. The company was formerly known as PT Ace Indoritel Perkakas and changed its name to PT Ace Hardware Indonesia Tbk in August 2001. The company was founded in 1995 and is headquartered in Jakarta, Indonesia. PT Ace Hardware Indonesia Tbk is a subsidiary of PT Kawan Lama Sejahtera.",Kawan Lama Building,Jakarta,11610,2007-11-06
ANTM.JK,PT Aneka Tambang Tbk,ID1000106602,Industrial Materials,Basic Materials,https://www.antam.com,"PT Aneka Tambang Tbk operates as a diversified mining and metals company in Indonesia. The company operates through three segments: Nickel, Precious Metals and Refinery, and Bauxite and Alumina. It is involved in the exploration, excavation, processing, and marketing of alumina, nickel ore, ferronickel, gold, silver, bauxite, and coal. The company also engages in the construction, trading, industry, agriculture, printing, and ground transportation businesses; and provision of industrial area management services. It also exports its products. The company was incorporated in 1968 and is headquartered in Jakarta, Indonesia. PT Aneka Tambang Tbk is a subsidiary of PT Indonesia Asahan Aluminium (Persero).",Gedung Aneka Tambang,Jakarta,12530,2005-09-29
BUMI.JK,PT Bumi Resources Tbk,ID1000068703,Coal,Energy,https://www.bumiresources.com,"PT Bumi Resources Tbk, together with its subsidiaries, engages in the mining activities in Indonesia. It operates through Coal, Services, Oil and Gas, and Gold segments. The Coal segment engages in the exploration, exploitation, and sale of coal deposits. The Services segment offers marketing and management services. The Oil and Gas segment explores for oil and gas properties. The Gold segment explores for gold properties. The company also exports its products. PT Bumi Resources Tbk was formerly known as PT Bumi Modern Tbk. and changed its name to PT Bumi Resources Tbk in September 2000. The company was founded in 1973 and is headquartered in Jakarta Selatan, Indonesia. PT Bumi Resources Tbk is a subsidiary of Long Haul Holdings Ltd.",Bakrie Tower Building,Jakarta Selatan,12940,2001-06-07
ASII.JK,PT Astra International Tbk,ID1000122807,Auto - Parts,Consumer Cyclical,https://www.astra.co.id,"PT Astra International Tbk, together with its subsidiaries, operates in the automotive, financial services, heavy equipment, mining, construction, energy, agri, infrastructure and logistics, information technology, and property businesses in Indonesia. It offers cars, trucks, and motorcycles of various brands; manufactures and sells automotive components to the original equipment for manufacturers and replacement markets, as well as provides consultation services to its customers; financing for cars, motorcycles, and heavy equipment; life, vehicle, and health insurance, as well as other insurance for commercial business; and various banking products and services. The company also distributes heavy equipment for the mining, plantation, construction, forestry, transportation, and material handling industries; provides coal mining contracting services; operates coal mines; and produces crude palm oil. In addition, it is involved in the operation of toll roads; rental of vehicles; sale of used cars; and provision of logistics and warehousing services, as well as freight forwarding service through ground, sea, and air transportation. Further, the company offers various information technology business solutions based on document, information, and communication technology; and engages in the property development and management activities. Additionally, it is involved in the foundation; formwork and bekisting; pump services; and mechanical, electrical, and plumbing works. The company was incorporated in 1957 and is headquartered in Jakarta, Indonesia. PT Astra International Tbk is a subsidiary of Jardine Cycle & Carriage Limited.",Menara Astra,Jakarta,10220,2000-10-17
INDF.JK,PT Indofood Sukses Makmur Tbk,ID1000057003,Packaged Foods,Consumer Defensive,https://www.indofood.com,"PT Indofood Sukses Makmur Tbk operates as a food solutions company in Indonesia and internationally. It operates through four segments: Consumer Branded Products Business Group, Bogasari Business Group, Agribusiness Group, and Distribution Business Group. The company offers noodles; ultra-high temperature (UHT), sterilized bottled, evaporated, pasteurized liquid, UHT multi-cereal, and powdered milk; milk-flavored and cereal powdered drinks, sweetened condensed creamer, ice cream, and butter; potato, cassava, soybean, corn, and various extruded snacks; recipe mixes, soy and chili sauce, tomato sauce, and stock soup; baby cereals; rice puffs, crunchies, biscuits, puddings, noodle soup, and pasta; cereal snacks for children; and ready-to-drink tea, packaged water, and fruit-flavored drinks. It also produces wheat flour, pasta, and coffee; distributes consumer products; manufactures and markets cooking oils, margarine, and shortening; cultivates sugar cane, rubber, industrial timber, cocoa, coconut, tea plantations, and other crops; extracts and processes coconut oil; operates bulking station; processes oils and fat; and markets and distributes culinary products. In addition, the company engages in the research and development, seed breeding, and oil palm cultivation and milling activities; shipping, investment and management, trade export agency, industrial estate agriculture, forestry, fishing, and trading and marketing activities; ownership and management of buildings; chain restaurant management; flour milling, blending, and trading; and provision of transportation, management consulting, and research management and technical services, as well as packaging materials and fertilizers. The company was formerly known as PT Panganjaya Intikusuma and changed its name to PT Indofood Sukses Makmur Tbk in 1994. The company was incorporated in 1990 and is based in Jakarta, Indonesia. PT Indofood Sukses Makmur Tbk is a subsidiary of First Pacific Investment Management Limited.",Sudirman Plaza,Jakarta,12910,2000-10-02
WEHA.JK,PT WEHA Transportasi Indonesia Tbk,ID1000105901,Railroads,Industrials,https://www.whitehorse.co.id,"PT WEHA Transportasi Indonesia Tbk, together with its subsidiaries, provides passenger transportation services in Indonesia. The company operates in three segments: Tourism Bus Charter, Intercity Shuttle, and Others. It operates bus rental business under the White Horse Deluxe Coach (WHDC) brand for domestic and international corporate customers, school kid's shuttle, employee's shuttle, and weddings, as well as passenger transport services for funeral home. The company also provides intercity shuttle services on the Jakarta, Bandung, Yogyakarta, Semarang, Solo, Salatiga, Jepara, Klaten, and Surabaya routes under the Day Trans brand, as well as online booking services. In addition, it offers car rental services; and sightseeing tour services. The company was formerly known as PT Panorama Transportasi Tbk and changed its name to PT WEHA Transportasi Indonesia Tbk in June 2015. PT WEHA Transportasi Indonesia Tbk was founded in 2001 and is headquartered in Tangerang, Indonesia.",Grha White Horse,Tangerang,15125,2007-06-04
BLUE.JK,PT Berkah Prima Perkasa Tbk,ID1000149800,Technology Distributors,Technology,https://www.blueprint-indonesia.com,"PT Berkah Prima Perkasa Tbk engages in trading and distribution of refill ink, laser toner, photo paper, POS hardware and software, sticker labels, and textile printing suite under the brand of Blueprint. The company sells inks for printers, including refill inks, cartridge refill inks, sublime inks, art paper inks that can be used for various types of printing needs, such as printing documents, photos, brochures, and design material, as well as master film offsets. It also provides textile printing services. PT Berkah Prima Perkasa Tbk was founded in 2005 and is headquartered in Jakarta Utara, Indonesia.",Jl. Kapuk Kamal Kapuk Business Park,Jakarta Utara,,2019-07-08
SMGR.JK,PT Semen Indonesia (Persero) Tbk,ID1000106800,Construction Materials,Basic Materials,https://sig.id,"PT Semen Indonesia (Persero) Tbk, together with its subsidiaries, manufactures, packs, and distributes cement in Indonesia and internationally. The company is also involved in limestone and clay mining; cement bag manufacturing; industrial real estate development and building rental; ready-mix concrete and aggregates quarry production; and consulting, mining, trading, transportation, and construction activities. In addition, it engages in the information system, investment, freight forwarding, stevedoring, sea transportation, service logistic management, outsourcing, and building materials businesses, as well as procures public goods and services. The company was formerly known as PT Semen Gresik (Persero) Tbk and changed its name to PT Semen Indonesia (Persero) Tbk in January 2013. PT Semen Indonesia (Persero) Tbk was founded in 1953 and is headquartered in Jakarta Selatan, Indonesia.","South Quarter, Tower A, Lantai 19-20",Jakarta Selatan,12430,2005-09-29
VKTR.JK,PT VKTR Teknologi Mobilitas Tbk,ID1000190309,Auto - Recreational Vehicles,Consumer Cyclical,https://vktr.id,"PT VKTR Teknologi Mobilitas Tbk engages in trading of automotive and metal components. It offers electric bus and motor, charging station, and telematics and smart fleet management. The company also trades battery-based electric vehicles; and provides foundry and automotive component, as well as vehicle body. In addition, it engages in manufacturing, wholesale, and leasing of automotive and components. The company was founded in 2007 and is headquartered in South Jakarta, Indonesia. PT VKTR Teknologi Mobilitas Tbk is a subsidiary of PT Bakrie & Brothers Tbk.",Bakrie Tower,South Jakarta,12940,2023-06-19
AYAM.JK,Janu Putra Sejahtera Tbk,ID1000199904,Agricultural Farm Products,Consumer Defensive,http://januputrasejahtera.com,"PT Janu Putra Sejahtera Tbk engages in chicken poultry farming. Its business includes breeding farm, broiler farming, laying farm, and egg hatching. The company was founded on April 11, 2008 and is headquartered in Sleman, Indonesia.","Ruko Casa Grande No.35,",Sleman,,2023-11-30
ISAT.JK,PT Indosat Ooredoo Hutchison Tbk,ID1000097405,Telecommunications Services,Communication Services,https://indosatooredoo.com,"PT Indosat Ooredoo Hutchison Tbk, together with its subsidiaries, provides telecommunication services in Indonesia. The company offers post-paid and prepaid products that include various data and mobile voice solutions on 2G, 3G, and 4G broadband cellular networks under the IM3 Ooredoo brand. It also provides international calls, international roaming, and fixed line services. In addition, the company offers IoT and M2M solutions; IT services through private data center and disaster recovery center; Internet connectivity and data communication services for corporate customers; satellite-based services, such as transponder leasing, VSAT services, and TV channels for TV; cloud-based service for business transformation; and voice services. It provides services under the Ooredoo brand name. The company was founded in 1967 and is based in Jakarta, Indonesia. PT Indosat Ooredoo Hutchison Tbk is a subsidiary of Ooredoo Hutchison Asia Pte. Ltd.",Jalan Medan Merdeka Barat No. 21,Jakarta,10110,2004-03-18
HOKI.JK,PT Buyung Poetra Sembada Tbk,ID1000139801,Packaged Foods,Consumer Defensive,https://www.topikoki.com,"PT Buyung Poetra Sembada Tbk manufactures and trades in rice and its derivative products in Indonesia. The company distributes rice through supermarkets and minimarkets under the Topikoki, Rumah Limas, Belida, BPS, Daily Meal, and HOKI brand names. It also engages in the trade, construction, land transportation, and printing activities; and rental of power plants. The company was founded in 2003 and is headquartered in Jakarta Timur, Indonesia. PT Buyung Poetra Sembada Tbk is a subsidiary of PT Buyung Investama Gemilang.",Pasar Induk Beras Cipinang Block K No.17,Jakarta Timur,13240,2017-07-03
SSTM.JK,PT Sunson Textile Manufacturer Tbk,ID1000081508,Apparel - Manufacturers,Consumer Cyclical,https://www.sunson.co.id,"PT Sunson Textile Manufacturer Tbk manufactures and sells yarn, fabric, and other textile products in Indonesia. The company operates in three segments: Spinning, Weaving, and Others. It is involved in general trading activities. The company also exports its products to Europe, America, rest of Asia, and Africa. PT Sunson Textile Manufacturer Tbk was founded in 1972 and is headquartered in Bandung, Indonesia.",Jl. Ranggamalela No. 27,Bandung,,2002-04-09
OLIV.JK,PT Oscar Mitra Sukses Sejahtera Tbk,ID1000167802,"Furnishings, Fixtures & Appliances",Consumer Cyclical,https://www.oscarliving.com,"PT Oscar Mitra Sukses Sejahtera Tbk engages in the wholesale trading of household appliances and equipment in Indonesia. The company offers bedroom, living room, dining room, office, kitchen, outdoor, and home décor and lifestyle furniture. It also engages in the retail trading of glassware and plastic kitchen utensils; specialized carpets, rugs, and wall and floor coverings; and stone, clay, wood, bamboo, and textiles. The company was founded in 1984 and is based in Jakarta Timur, Indonesia.",Bidara Cina,Jakarta Timur,13330,2022-05-17
UNVR.JK,PT Unilever Indonesia Tbk,ID1000095706,Household & Personal Products,Consumer Defensive,https://www.unilever.co.id,"PT Unilever Indonesia Tbk manufactures, markets, and distributes consumer goods in Indonesia. It offers soaps, detergents, dairy based foods, ice creams, savories, soy sauce, cosmetic products, tea-based beverages, and fruit juices. The company provides its products under the Axe, Bango, Buavita, Cif, Citra, Clear, Clear Men, Close Up, Cornetto, Dove, Feast, Feast, Glow & Lovely, Hellmann's, Jawara, Knorr, Lifebuoy, Lipton, Love Beauty & Planet, Lux, Magnum, Molto, Paddle Pop, Pepsodent, Pond's, Pond's Men, Populaire, Rexona, Rinso, Royco, SariWangi, Seru, Simple, St. Ives, Suave, Sunlight, Sunsilk, Superpell, TRESemmé, The Vegetarian Butcher, Unilever Professional, Vaseline Men, Viennetta, Vixal, Wall's, Wipol, Zwitsalm, and other brands. It also leases office space. The company was founded in 1933 and is headquartered in Tangerang, Indonesia. PT Unilever Indonesia Tbk is a subsidiary of Unilever Indonesia Holding B.V.",Grha Unilever,Tangerang,15345,2003-09-03
DMAS.JK,PT Puradelta Lestari Tbk,ID1000134109,Real Estate - Development,Real Estate,https://www.deltamas.id,"PT Puradelta Lestari Tbk engages in the real estate development business in Indonesia. It operates through Industrial, Residential, Commercial, Hotel, and Rental segments. The company sells commercial lots and commercial products, including shop houses; residential products, such as landed houses; and develops investment properties of rental factories and hotels, as well as provides clean water supply, waste water treatment, and estate management services comprising cleaning, security, repair and maintenance, and other services. It also develops and manages Kota Deltamas, an integrated township of 3,200 hectares consisting of industrial, residential, and commercial estates. The company operates 19 residential clusters, seven rental factory units, and one hotel. The company was incorporated in 1993 and is headquartered in West Jakarta, Indonesia. PT Puradelta Lestari Tbk is a subsidiary of PT Sumber Arusmulia.",Jl. Kali Besar Barat No. 8,Jakarta Barat,,2015-05-29
PTBA.JK,PT Bukit Asam Tbk,ID1000094006,Coal,Energy,https://www.ptba.co.id,"PT Bukit Asam Tbk, together with its subsidiaries, engages in the coal mining activities in Indonesia. Its coal mining activities include general surveying, exploration, exploitation, processing, refining, transportation, and trading. It manages special coal port facilities; operates steam power plants; and provides consulting services related to the coal mining industry and production. The company also offers briquette processing, mining services, oil palm plantation and processing, and health services, as well as real estate and construction services. It also operates in China, the Philippines, Taiwan, Japan, India, Malaysia, South Korea, Thailand, Vietnam, Hong Kong, and internationally. The company was formerly known as PT Bukit Asam Persero Tbk and changed its name to PT Bukit Asam Tbk in November 2017. PT Bukit Asam Tbk was founded in 1919 and is headquartered in Tanjung Enim Selatan, Indonesia. PT Bukit Asam Tbk is a subsidiary of PT Indonesia Asahan Aluminium (Persero).",Jl. Parigi No. 1,Tanjung Enim Selatan,31716,2002-12-23
BBNI.JK,PT Bank Negara Indonesia (Persero) Tbk,ID1000096605,Banks - Regional,Financial Services,https://www.bni.co.id,"PT Bank Negara Indonesia (Persero) Tbk, together with its subsidiaries, provides various banking products and services in Indonesia, the United States, Europe, and Asia. The company offers current, savings, and money market accounts, and time deposit products. It also provides credit facilities for the purchase of houses, villas, apartments, condominiums, home shops, home offices, and land plots, as well as for construction/renovation, top-up, and refinancing; and pension loans. In addition, the company offers debit and credit cards; SMS, Internet, and phone banking services, as well as automated teller machines; treasury services; transactional banking products, such as payment, collection, liquidity, and information management services; small and long-term loans, which include working capital credit, investment credit, bank guarantee, local letter of credit, and letter of credit; and customer analysis and portfolio management services. Further, it provides facilities for foreign exchange services; investment products, such as government, retail, and company bonds; transaction derivatives; BNIFX, a web-based digital platform to conduct non-physical forex transactions directly with BNI treasury dealers; local currency settlement; and trade finance services, which include export and import LC and non-LC, standby letter of credit, bill collection financing, open account financing, and BNI Trade Online, a digital service to submit requests for trade transactions online. The company serves agriculture, telecommunication, food and beverage, oil and gas, mining, chemicals, construction, electricity, and wholesale and retail. As of December 31, 2021, the company operated 195 domestic branches, 1,097 sub-branches, and 874 other outlets, as well as 5 overseas branches located in Singapore, Hong Kong, Tokyo, London, and Seoul; and 1 representative office in New York. PT Bank Negara Indonesia (Persero) Tbk was founded in 1946 and is headquartered in Jakarta Pusat, Indonesia.",Gedung Grha BNI,Jakarta Pusat,10220,2003-12-23
JKON.JK,PT Jaya Konstruksi Manggala Pratama Tbk,ID1000129307,Conglomerates,Industrials,https://www.jayakonstruksi.com,"PT Jaya Konstruksi Manggala Pratama Tbk engages in the construction business in Indonesia. The company is also involved in asphalt and liquefied petroleum gas trading; provision of specialized mechanical and electrical engineering, contractorand services; LPG and bulk transportation; chartering of vessels; and trading, manufacturing, and workshop and industry activities. In addition, it owns or leases real estate properties; and trades in materials and chemical goods. The company was founded in 1982 and is based in Jakarta, Indonesia.",Building B,Jakarta,12330,2007-12-04
SMSM.JK,PT Selamat Sempurna Tbk,ID1000095409,Auto - Parts,Consumer Cyclical,https://smsm.co.id,"PT Selamat Sempurna Tbk manufactures and sells tools or equipment for vehicles, heavy equipment, and other machinery. It operates through five segments: Filter, Radiator, Body Maker, Trading, and Others. The company offers radiators under the ADR brand; dump hoists and body makers of dump trucks, trailers, mixers, and tanks; rubber, plastisol, brake and fuel pipes, fuel tanks, and mufflers; and air and liquid filters, such as oil, hydraulic, and fuel filters for automotive, commercial, heavy equipment, marine, and industrial applications under the SAKURA brand name. It also manufactures rubber O-rings, polyurethanes, and plastisol adhesives for automotive industries. It exports its products to approximately 120 countries worldwide. The company was founded in 1976 and is headquartered in Jakarta Utara, Indonesia. PT Selamat Sempurna Tbk is a subsidiary of PT Adrindo Intiperkasa.",Wisma ADR,Jakarta,14440,2002-01-07
OILS.JK,PT Indo Oil Perkasa Tbk,ID1000162803,Packaged Foods,Consumer Defensive,https://indooilperkasa.com,"PT Indo Oil Perkasa Tbk produces, distributes, and exports coconut oil and related derivative products. The company's products include crude and refined coconut oil, and copra meal. PT Indo Oil Perkasa Tbk was founded in 2016 and is based in Mojokerto, Indonesia.",Jl. Raya Perning km. 39,Mojokerto,,2021-09-06
